{
  "id": "coral-drift",
  "name": "Coral Drift",
  "appBackground": "#081018",
  "surface": "#0f1a26",
  "surfaceAlt": "#172636",
  "border": "#3a5468",
  "text": "#f4ebe4",
  "textMuted": "#9aa8b4",
  "accent": "#ff6f61",
  "accentContrast": "#180606",
  "focus": "#ff9b86",
  "danger": "#ff4d62",
  "warning": "#f0b35a",
  "success": "#5dcaa0",
  "scrollbarTrack": "#0c1620",
  "scrollbarThumb": "#2e4556",
  "scrollbarThumbHover": "#ff6f61",
  "terminal": {
    "background": "#060d14",
    "foreground": "#eadfd6",
    "cursor": "#ff9b86",
    "selection": "#4a2a28",
    "black": "#121c26",
    "red": "#ff6f61",
    "green": "#5dcaa0",
    "yellow": "#f0b35a",
    "blue": "#5a8cba",
    "magenta": "#d07a8c",
    "cyan": "#6ab4b8",
    "white": "#eadfd6",
    "brightBlack": "#546878",
    "brightRed": "#ff9488",
    "brightGreen": "#80e0ba",
    "brightYellow": "#ffd082",
    "brightBlue": "#80b0d8",
    "brightMagenta": "#eaa0b0",
    "brightCyan": "#8ed4d8",
    "brightWhite": "#fff6f0"
  }
}
