{
  "id": "amaranth-drive",
  "name": "Amaranth Drive",
  "appBackground": "#140810",
  "surface": "#1f0e18",
  "surfaceAlt": "#301820",
  "border": "#6a3048",
  "text": "#f8e6ee",
  "textMuted": "#b8889c",
  "accent": "#e03e8a",
  "accentContrast": "#18060e",
  "focus": "#ff7ab8",
  "danger": "#ff4068",
  "warning": "#e8b04a",
  "success": "#58c888",
  "scrollbarTrack": "#180c14",
  "scrollbarThumb": "#542438",
  "scrollbarThumbHover": "#e03e8a",
  "terminal": {
    "background": "#10060c",
    "foreground": "#f0d8e4",
    "cursor": "#ff7ab8",
    "selection": "#5a2040",
    "black": "#221018",
    "red": "#ff4068",
    "green": "#58c888",
    "yellow": "#e8b04a",
    "blue": "#6a80c0",
    "magenta": "#e03e8a",
    "cyan": "#58b8c0",
    "white": "#f0d8e4",
    "brightBlack": "#704858",
    "brightRed": "#ff708c",
    "brightGreen": "#78e0a4",
    "brightYellow": "#ffd078",
    "brightBlue": "#90a8e0",
    "brightMagenta": "#ff7ab8",
    "brightCyan": "#80d4dc",
    "brightWhite": "#fff0f6"
  }
}
