{
  "id": "cobalt-foundry",
  "name": "Cobalt Foundry",
  "appBackground": "#060910",
  "surface": "#0c1220",
  "surfaceAlt": "#141c30",
  "border": "#2a3e68",
  "text": "#e6eef8",
  "textMuted": "#7e90b0",
  "accent": "#2f6bff",
  "accentContrast": "#f4f7ff",
  "focus": "#6d9cff",
  "danger": "#ff5a6e",
  "warning": "#e8b04a",
  "success": "#3dcc90",
  "scrollbarTrack": "#0a101c",
  "scrollbarThumb": "#243656",
  "scrollbarThumbHover": "#2f6bff",
  "terminal": {
    "background": "#04070c",
    "foreground": "#d6e2f0",
    "cursor": "#6d9cff",
    "selection": "#1e3a68",
    "black": "#101828",
    "red": "#ff5a6e",
    "green": "#3dcc90",
    "yellow": "#e8b04a",
    "blue": "#2f6bff",
    "magenta": "#8a6ad8",
    "cyan": "#3cb8d8",
    "white": "#d6e2f0",
    "brightBlack": "#4a5c80",
    "brightRed": "#ff8494",
    "brightGreen": "#64e8b0",
    "brightYellow": "#ffd078",
    "brightBlue": "#6d9cff",
    "brightMagenta": "#b090f0",
    "brightCyan": "#68d8f0",
    "brightWhite": "#f4f8ff"
  }
}
