{
  "id": "synthwave-94",
  "name": "Synthwave '94",
  "appBackground": "#090312",
  "surface": "#140822",
  "surfaceAlt": "#211036",
  "border": "#512568",
  "text": "#f8e9ff",
  "textMuted": "#b396c2",
  "accent": "#ff4fd8",
  "accentContrast": "#160312",
  "focus": "#43e7e0",
  "danger": "#ff416c",
  "warning": "#ffd166",
  "success": "#52f7b8",
  "scrollbarTrack": "#10061b",
  "scrollbarThumb": "#48205f",
  "scrollbarThumbHover": "#713184",
  "terminal": {
    "background": "#08020f",
    "foreground": "#f4dcff",
    "cursor": "#43e7e0",
    "selection": "#45205f",
    "black": "#181021",
    "red": "#ff416c",
    "green": "#52f7b8",
    "yellow": "#ffd166",
    "blue": "#5b8cff",
    "magenta": "#ff4fd8",
    "cyan": "#43e7e0",
    "white": "#e9d8f2",
    "brightBlack": "#6e557d",
    "brightRed": "#ff6c91",
    "brightGreen": "#80ffd0",
    "brightYellow": "#ffe29a",
    "brightBlue": "#89abff",
    "brightMagenta": "#ff87e5",
    "brightCyan": "#75fff6",
    "brightWhite": "#fff6ff"
  }
}
