{
  "id": "viridian-core",
  "name": "Viridian Core",
  "appBackground": "#050b09",
  "surface": "#0a1511",
  "surfaceAlt": "#10221a",
  "border": "#1f4434",
  "text": "#dff5e9",
  "textMuted": "#7ca491",
  "accent": "#47e57e",
  "accentContrast": "#031008",
  "focus": "#70ff9f",
  "danger": "#ff536b",
  "warning": "#d9ce52",
  "success": "#47e57e",
  "scrollbarTrack": "#0a1511",
  "scrollbarThumb": "#1f4434",
  "scrollbarThumbHover": "#47e57e",
  "terminal": {
    "background": "#050b09",
    "foreground": "#cce8d8",
    "cursor": "#47e57e",
    "selection": "#16522e",
    "black": "#0d1d16",
    "red": "#ff536b",
    "green": "#47e57e",
    "yellow": "#d9ce52",
    "blue": "#4d8ec9",
    "magenta": "#a66bd1",
    "cyan": "#47d6b0",
    "white": "#cce8d8",
    "brightBlack": "#37604d",
    "brightRed": "#ff7a8d",
    "brightGreen": "#70ff9f",
    "brightYellow": "#f5ea78",
    "brightBlue": "#71afe7",
    "brightMagenta": "#ca8cf1",
    "brightCyan": "#68f3ca",
    "brightWhite": "#effff5"
  }
}