{
  "id": "xeno-signal",
  "name": "Xeno Signal",
  "appBackground": "#030a08",
  "surface": "#07130f",
  "surfaceAlt": "#0c2018",
  "border": "#1d4a34",
  "text": "#dcf5e3",
  "textMuted": "#7da68d",
  "accent": "#7ef542",
  "accentContrast": "#061003",
  "focus": "#49ffc2",
  "danger": "#ff526d",
  "warning": "#d8e65d",
  "success": "#7ef542",
  "scrollbarTrack": "#06100c",
  "scrollbarThumb": "#183c2b",
  "scrollbarThumbHover": "#286344",
  "terminal": {
    "background": "#020705",
    "foreground": "#ccebd4",
    "cursor": "#7ef542",
    "selection": "#1e5037",
    "black": "#0d1c16",
    "red": "#ff526d",
    "green": "#7ef542",
    "yellow": "#d8e65d",
    "blue": "#4b8fc9",
    "magenta": "#a96ce0",
    "cyan": "#49ffc2",
    "white": "#ccebd4",
    "brightBlack": "#426b56",
    "brightRed": "#ff7a8d",
    "brightGreen": "#a2ff70",
    "brightYellow": "#f0f58a",
    "brightBlue": "#72b8ed",
    "brightMagenta": "#cf91ff",
    "brightCyan": "#82ffda",
    "brightWhite": "#effff3"
  }
}