{
  "id": "saffron-deck",
  "name": "Saffron Deck",
  "appBackground": "#0d0b07",
  "surface": "#17130b",
  "surfaceAlt": "#241e10",
  "border": "#59471f",
  "text": "#fff3cd",
  "textMuted": "#bca778",
  "accent": "#dcae32",
  "accentContrast": "#171003",
  "focus": "#ffd45a",
  "danger": "#ef596f",
  "warning": "#dcae32",
  "success": "#62d49a",
  "scrollbarTrack": "#17130b",
  "scrollbarThumb": "#59471f",
  "scrollbarThumbHover": "#dcae32",
  "terminal": {
    "background": "#0d0b07",
    "foreground": "#f2e3b6",
    "cursor": "#ffd45a",
    "selection": "#66531d",
    "black": "#1f1a0e",
    "red": "#ef596f",
    "green": "#62d49a",
    "yellow": "#dcae32",
    "blue": "#638fda",
    "magenta": "#a96fe0",
    "cyan": "#57c8c4",
    "white": "#f2e3b6",
    "brightBlack": "#6c5b32",
    "brightRed": "#ff7a8d",
    "brightGreen": "#81efb5",
    "brightYellow": "#ffd45a",
    "brightBlue": "#86b2ff",
    "brightMagenta": "#c896ff",
    "brightCyan": "#78e9e4",
    "brightWhite": "#fff8df"
  }
}