{
  "id": "teal-current",
  "name": "Teal Current",
  "appBackground": "#071018",
  "surface": "#0d1a24",
  "surfaceAlt": "#142634",
  "border": "#294457",
  "text": "#edf7f8",
  "textMuted": "#8eabb3",
  "accent": "#26d9d1",
  "accentContrast": "#031111",
  "focus": "#69fff4",
  "danger": "#ff6573",
  "warning": "#f4c65e",
  "success": "#53e69c",
  "scrollbarTrack": "#0d1a24",
  "scrollbarThumb": "#294457",
  "scrollbarThumbHover": "#26d9d1",
  "terminal": {
    "background": "#071018",
    "foreground": "#d9ebee",
    "cursor": "#26d9d1",
    "selection": "#174b52",
    "black": "#10212b",
    "red": "#ff6573",
    "green": "#53e69c",
    "yellow": "#f4c65e",
    "blue": "#4d9fe8",
    "magenta": "#ba79e8",
    "cyan": "#26d9d1",
    "white": "#d9ebee",
    "brightBlack": "#3e6170",
    "brightRed": "#ff8490",
    "brightGreen": "#74ffb8",
    "brightYellow": "#ffe089",
    "brightBlue": "#76bdff",
    "brightMagenta": "#d69cff",
    "brightCyan": "#69fff4",
    "brightWhite": "#ffffff"
  }
}