{
  "id": "matte-obsidian",
  "name": "Matte Obsidian",
  "appBackground": "#0c0c0c",
  "surface": "#141414",
  "surfaceAlt": "#1c1c1c",
  "border": "#292929",
  "text": "#e8e8e8",
  "textMuted": "#7a7a7a",
  "accent": "#ffffff",
  "accentContrast": "#0c0c0c",
  "focus": "#888888",
  "danger": "#eb4d4b",
  "warning": "#f0932b",
  "success": "#6ab04c",
  "scrollbarTrack": "#0e0e0e",
  "scrollbarThumb": "#2a2a2a",
  "scrollbarThumbHover": "#444444",
  "terminal": {
    "background": "#080808",
    "foreground": "#e0e0e0",
    "cursor": "#ffffff",
    "selection": "#333333",
    "black": "#1f1f1f",
    "red": "#eb4d4b",
    "green": "#6ab04c",
    "yellow": "#f0932b",
    "blue": "#4a90e2",
    "magenta": "#a55eea",
    "cyan": "#00d2d3",
    "white": "#dcdde1",
    "brightBlack": "#57606f",
    "brightRed": "#ff6b6b",
    "brightGreen": "#7bed9f",
    "brightYellow": "#ffa502",
    "brightBlue": "#70a1ff",
    "brightMagenta": "#c56cf0",
    "brightCyan": "#48dbfb",
    "brightWhite": "#ffffff"
  }
}