{
  "id": "chrome-cathedral",
  "name": "Chrome Cathedral",
  "appBackground": "#0a0c0e",
  "surface": "#13171b",
  "surfaceAlt": "#1c2228",
  "border": "#4a5560",
  "text": "#eef2f5",
  "textMuted": "#8b97a3",
  "accent": "#c5d4de",
  "accentContrast": "#0b0e11",
  "focus": "#ffffff",
  "danger": "#e85d6a",
  "warning": "#e0b86a",
  "success": "#6fc9a0",
  "scrollbarTrack": "#101418",
  "scrollbarThumb": "#3a4550",
  "scrollbarThumbHover": "#c5d4de",
  "terminal": {
    "background": "#080a0c",
    "foreground": "#dfe6ec",
    "cursor": "#ffffff",
    "selection": "#3a4754",
    "black": "#171c21",
    "red": "#e85d6a",
    "green": "#6fc9a0",
    "yellow": "#e0b86a",
    "blue": "#7a93a8",
    "magenta": "#a8889c",
    "cyan": "#7fb3b8",
    "white": "#dfe6ec",
    "brightBlack": "#5a6570",
    "brightRed": "#ff808c",
    "brightGreen": "#8fe0bb",
    "brightYellow": "#f5d38a",
    "brightBlue": "#9cb6cc",
    "brightMagenta": "#c8a8bc",
    "brightCyan": "#a0d4d8",
    "brightWhite": "#ffffff"
  }
}
