{
  "id": "tungsten-pulse",
  "name": "Tungsten Pulse",
  "appBackground": "#0d0d0e",
  "surface": "#161618",
  "surfaceAlt": "#212124",
  "border": "#4a4a50",
  "text": "#f0eeec",
  "textMuted": "#9b9a9e",
  "accent": "#ff9c52",
  "accentContrast": "#1a0d02",
  "focus": "#ffc98a",
  "danger": "#ff5c5c",
  "warning": "#ffcf5c",
  "success": "#7fd88a",
  "scrollbarTrack": "#111113",
  "scrollbarThumb": "#3a3a40",
  "scrollbarThumbHover": "#ff9c52",
  "terminal": {
    "background": "#0a0a0b",
    "foreground": "#e8e6e4",
    "cursor": "#ffc98a",
    "selection": "#3a3a40",
    "black": "#242428",
    "red": "#ff5c5c",
    "green": "#7fd88a",
    "yellow": "#ffcf5c",
    "blue": "#7a92b0",
    "magenta": "#c088b0",
    "cyan": "#7cc4c0",
    "white": "#e8e6e4",
    "brightBlack": "#5a5a60",
    "brightRed": "#ff8080",
    "brightGreen": "#a0eaa8",
    "brightYellow": "#ffe090",
    "brightBlue": "#9cb0cc",
    "brightMagenta": "#dcaad0",
    "brightCyan": "#a0e0dc",
    "brightWhite": "#fbfaf8"
  }
}
