{
  "id": "crimson-relay",
  "name": "Crimson Relay",
  "appBackground": "#090b0f",
  "surface": "#11151b",
  "surfaceAlt": "#191f27",
  "border": "#343b46",
  "text": "#f3f4f2",
  "textMuted": "#9ba2aa",
  "accent": "#d9272e",
  "accentContrast": "#ffffff",
  "focus": "#f04449",
  "danger": "#ff4d57",
  "warning": "#e7b75c",
  "success": "#58c78b",
  "scrollbarTrack": "#11151b",
  "scrollbarThumb": "#343b46",
  "scrollbarThumbHover": "#d9272e",
  "terminal": {
    "background": "#090b0f",
    "foreground": "#e5e7e8",
    "cursor": "#d9272e",
    "selection": "#51252a",
    "black": "#161a20",
    "red": "#d9272e",
    "green": "#58c78b",
    "yellow": "#e7b75c",
    "blue": "#6d93c9",
    "magenta": "#a977c8",
    "cyan": "#63bfc0",
    "white": "#e5e7e8",
    "brightBlack": "#515965",
    "brightRed": "#ff4d57",
    "brightGreen": "#77e0a4",
    "brightYellow": "#ffd27a",
    "brightBlue": "#8eb7ed",
    "brightMagenta": "#c99be7",
    "brightCyan": "#83dddd",
    "brightWhite": "#ffffff"
  }
}