{
  "id": "ion-storm",
  "name": "Ion Storm",
  "appBackground": "#05060f",
  "surface": "#0c0e1c",
  "surfaceAlt": "#151833",
  "border": "#3a3f78",
  "text": "#e8eaff",
  "textMuted": "#8b90c4",
  "accent": "#6b5cff",
  "accentContrast": "#0a0818",
  "focus": "#c4c0ff",
  "danger": "#ff5e8a",
  "warning": "#ffc857",
  "success": "#4de0b5",
  "scrollbarTrack": "#090b16",
  "scrollbarThumb": "#2c3166",
  "scrollbarThumbHover": "#4a50a0",
  "terminal": {
    "background": "#03040a",
    "foreground": "#dce0ff",
    "cursor": "#c4c0ff",
    "selection": "#2a2f6a",
    "black": "#121428",
    "red": "#ff5e8a",
    "green": "#4de0b5",
    "yellow": "#ffc857",
    "blue": "#6b5cff",
    "magenta": "#c86bff",
    "cyan": "#7ad4ff",
    "white": "#dce0ff",
    "brightBlack": "#555a8a",
    "brightRed": "#ff86a8",
    "brightGreen": "#72f5cd",
    "brightYellow": "#ffe08a",
    "brightBlue": "#9b90ff",
    "brightMagenta": "#e09aff",
    "brightCyan": "#a6e6ff",
    "brightWhite": "#f6f7ff"
  }
}
