{
  "id": "abyssal-console",
  "name": "Abyssal Console",
  "appBackground": "#02090e",
  "surface": "#05131b",
  "surfaceAlt": "#0a202b",
  "border": "#164254",
  "text": "#dbf2f2",
  "textMuted": "#759ca2",
  "accent": "#27d8c7",
  "accentContrast": "#03110f",
  "focus": "#4eeaff",
  "danger": "#ff667a",
  "warning": "#e7bd5a",
  "success": "#50df9b",
  "scrollbarTrack": "#041017",
  "scrollbarThumb": "#123746",
  "scrollbarThumbHover": "#1d596b",
  "terminal": {
    "background": "#01070b",
    "foreground": "#cce8e8",
    "cursor": "#4eeaff",
    "selection": "#164351",
    "black": "#0b1b22",
    "red": "#ff667a",
    "green": "#50df9b",
    "yellow": "#e7bd5a",
    "blue": "#4a94c7",
    "magenta": "#9874c7",
    "cyan": "#27d8c7",
    "white": "#cce8e8",
    "brightBlack": "#466873",
    "brightRed": "#ff8a99",
    "brightGreen": "#78f5b8",
    "brightYellow": "#f7d982",
    "brightBlue": "#71b9e9",
    "brightMagenta": "#ba9ae4",
    "brightCyan": "#60f3e3",
    "brightWhite": "#efffff"
  }
}