{
  "id": "frost-volt",
  "name": "Frost Volt",
  "appBackground": "#080b10",
  "surface": "#0f1724",
  "surfaceAlt": "#162236",
  "border": "#1e3558",
  "text": "#d8ecf8",
  "textMuted": "#6b8fae",
  "accent": "#ffd166",
  "accentContrast": "#080b10",
  "focus": "#70d6ff",
  "danger": "#ff4d6d",
  "warning": "#ffd166",
  "success": "#06d6a0",
  "scrollbarTrack": "#0a0e16",
  "scrollbarThumb": "#1e3558",
  "scrollbarThumbHover": "#70d6ff",
  "terminal": {
    "background": "#05070a",
    "foreground": "#d0e8f8",
    "cursor": "#70d6ff",
    "selection": "#1a365d",
    "black": "#101b2b",
    "red": "#ff4d6d",
    "green": "#06d6a0",
    "yellow": "#ffd166",
    "blue": "#118ab2",
    "magenta": "#8338ec",
    "cyan": "#70d6ff",
    "white": "#e2f1fc",
    "brightBlack": "#2c486e",
    "brightRed": "#ff758f",
    "brightGreen": "#38efbd",
    "brightYellow": "#ffe08a",
    "brightBlue": "#3a86ff",
    "brightMagenta": "#9d4edd",
    "brightCyan": "#99e2ff",
    "brightWhite": "#ffffff"
  }
}