{
  "id": "reactor-warning",
  "name": "Reactor Warning",
  "appBackground": "#0b0c09",
  "surface": "#13150f",
  "surfaceAlt": "#1d2117",
  "border": "#444a2c",
  "text": "#ecf0d9",
  "textMuted": "#9aa17a",
  "accent": "#c8f23d",
  "accentContrast": "#0c1102",
  "focus": "#f5c542",
  "danger": "#ff5b45",
  "warning": "#f5c542",
  "success": "#85d94f",
  "scrollbarTrack": "#11120d",
  "scrollbarThumb": "#363b24",
  "scrollbarThumbHover": "#555d31",
  "terminal": {
    "background": "#080906",
    "foreground": "#e0e7c6",
    "cursor": "#c8f23d",
    "selection": "#3c4721",
    "black": "#181a12",
    "red": "#ff5b45",
    "green": "#85d94f",
    "yellow": "#f5c542",
    "blue": "#6e8fb8",
    "magenta": "#b276ad",
    "cyan": "#5bc6a2",
    "white": "#d6ddbd",
    "brightBlack": "#5b6044",
    "brightRed": "#ff806e",
    "brightGreen": "#aaf36d",
    "brightYellow": "#ffe178",
    "brightBlue": "#91b2db",
    "brightMagenta": "#d49bd0",
    "brightCyan": "#7ee8c3",
    "brightWhite": "#f8ffe0"
  }
}