{
  "id": "azure-rift",
  "name": "Azure Rift",
  "appBackground": "#06101c",
  "surface": "#0c1a2c",
  "surfaceAlt": "#14263c",
  "border": "#2a4e78",
  "text": "#e8f2ff",
  "textMuted": "#7ea0c0",
  "accent": "#1a8fff",
  "accentContrast": "#041018",
  "focus": "#6cbcff",
  "danger": "#ff5e78",
  "warning": "#f0c04a",
  "success": "#3ed4a0",
  "scrollbarTrack": "#0a1624",
  "scrollbarThumb": "#224868",
  "scrollbarThumbHover": "#1a8fff",
  "terminal": {
    "background": "#040c16",
    "foreground": "#d4e6f8",
    "cursor": "#6cbcff",
    "selection": "#1a4a78",
    "black": "#102030",
    "red": "#ff5e78",
    "green": "#3ed4a0",
    "yellow": "#f0c04a",
    "blue": "#1a8fff",
    "magenta": "#8a78e0",
    "cyan": "#2ab8e0",
    "white": "#d4e6f8",
    "brightBlack": "#4a6a88",
    "brightRed": "#ff889c",
    "brightGreen": "#68ecc0",
    "brightYellow": "#ffd878",
    "brightBlue": "#6cbcff",
    "brightMagenta": "#b0a0f4",
    "brightCyan": "#68d8f4",
    "brightWhite": "#f4faff"
  }
}
