{
  "id": "olive-circuit",
  "name": "Olive Circuit",
  "appBackground": "#0c0e09",
  "surface": "#161910",
  "surfaceAlt": "#222618",
  "border": "#4a5234",
  "text": "#e8ead4",
  "textMuted": "#9aa078",
  "accent": "#9aaa4a",
  "accentContrast": "#101404",
  "focus": "#c4d46e",
  "danger": "#d4644a",
  "warning": "#d4b04a",
  "success": "#7aaa58",
  "scrollbarTrack": "#121410",
  "scrollbarThumb": "#3a4028",
  "scrollbarThumbHover": "#9aaa4a",
  "terminal": {
    "background": "#0a0c07",
    "foreground": "#dcdcb8",
    "cursor": "#c4d46e",
    "selection": "#3e4624",
    "black": "#1a1c12",
    "red": "#d4644a",
    "green": "#7aaa58",
    "yellow": "#d4b04a",
    "blue": "#6a8490",
    "magenta": "#8a7868",
    "cyan": "#6a9888",
    "white": "#dcdcb8",
    "brightBlack": "#5a6044",
    "brightRed": "#e88870",
    "brightGreen": "#9ccc74",
    "brightYellow": "#ecd078",
    "brightBlue": "#8aa4b0",
    "brightMagenta": "#ac9888",
    "brightCyan": "#8cb8a8",
    "brightWhite": "#f4f4dc"
  }
}
