{
  "id": "rust-lantern",
  "name": "Rust Lantern",
  "appBackground": "#11100d",
  "surface": "#1b1914",
  "surfaceAlt": "#27231b",
  "border": "#4a4030",
  "text": "#e9e2d3",
  "textMuted": "#a69b87",
  "accent": "#d77a24",
  "accentContrast": "#1a0c02",
  "focus": "#f29a3d",
  "danger": "#d95545",
  "warning": "#e3b455",
  "success": "#7ca66b",
  "scrollbarTrack": "#1b1914",
  "scrollbarThumb": "#4a4030",
  "scrollbarThumbHover": "#d77a24",
  "terminal": {
    "background": "#11100d",
    "foreground": "#ddd5c5",
    "cursor": "#d77a24",
    "selection": "#5c3a1c",
    "black": "#211f19",
    "red": "#d95545",
    "green": "#7ca66b",
    "yellow": "#e3b455",
    "blue": "#728da0",
    "magenta": "#a2778b",
    "cyan": "#6e9c97",
    "white": "#ddd5c5",
    "brightBlack": "#665e50",
    "brightRed": "#f17764",
    "brightGreen": "#9bc68a",
    "brightYellow": "#ffd277",
    "brightBlue": "#91aec3",
    "brightMagenta": "#c596ad",
    "brightCyan": "#8bbdb7",
    "brightWhite": "#fff8e8"
  }
}