{
  "id": "brass-hearth",
  "name": "Brass Hearth",
  "appBackground": "#100c08",
  "surface": "#1a130d",
  "surfaceAlt": "#281d13",
  "border": "#59432b",
  "text": "#f0dfbf",
  "textMuted": "#ad9270",
  "accent": "#d8a64a",
  "accentContrast": "#170d02",
  "focus": "#f2c66c",
  "danger": "#c84e3b",
  "warning": "#d8a64a",
  "success": "#7fa572",
  "scrollbarTrack": "#1a130d",
  "scrollbarThumb": "#59432b",
  "scrollbarThumbHover": "#d8a64a",
  "terminal": {
    "background": "#100c08",
    "foreground": "#e2d0ad",
    "cursor": "#d8a64a",
    "selection": "#65471d",
    "black": "#21170f",
    "red": "#c84e3b",
    "green": "#7fa572",
    "yellow": "#d8a64a",
    "blue": "#6f8ea0",
    "magenta": "#9e7585",
    "cyan": "#719b91",
    "white": "#e2d0ad",
    "brightBlack": "#6e573d",
    "brightRed": "#e76f58",
    "brightGreen": "#9fc495",
    "brightYellow": "#f2c66c",
    "brightBlue": "#8eacbd",
    "brightMagenta": "#be94a5",
    "brightCyan": "#90bbb0",
    "brightWhite": "#fff0cf"
  }
}