{
  "id": "cryo-lab",
  "name": "Cryo Lab",
  "appBackground": "#061018",
  "surface": "#0a1924",
  "surfaceAlt": "#102737",
  "border": "#28516a",
  "text": "#e8f7ff",
  "textMuted": "#89adbf",
  "accent": "#67ddff",
  "accentContrast": "#031117",
  "focus": "#a3efff",
  "danger": "#ff6f91",
  "warning": "#f3c969",
  "success": "#5fe0bd",
  "scrollbarTrack": "#08141d",
  "scrollbarThumb": "#21465d",
  "scrollbarThumbHover": "#34708e",
  "terminal": {
    "background": "#040c12",
    "foreground": "#d9f1fb",
    "cursor": "#a3efff",
    "selection": "#1f4a60",
    "black": "#10202a",
    "red": "#ff6f91",
    "green": "#5fe0bd",
    "yellow": "#f3c969",
    "blue": "#6ba7ff",
    "magenta": "#b995ff",
    "cyan": "#67ddff",
    "white": "#d9f1fb",
    "brightBlack": "#4f7182",
    "brightRed": "#ff96ad",
    "brightGreen": "#8cf5d5",
    "brightYellow": "#ffe09a",
    "brightBlue": "#96c2ff",
    "brightMagenta": "#d0b7ff",
    "brightCyan": "#9decff",
    "brightWhite": "#ffffff"
  }
}