{
  "id": "copper-halo",
  "name": "Copper Halo",
  "appBackground": "#0e0a08",
  "surface": "#1a120e",
  "surfaceAlt": "#281c16",
  "border": "#684830",
  "text": "#f4e6d4",
  "textMuted": "#b09070",
  "accent": "#d4895a",
  "accentContrast": "#160c06",
  "focus": "#5ec4a8",
  "danger": "#d45448",
  "warning": "#e0a048",
  "success": "#6aaa70",
  "scrollbarTrack": "#140e0a",
  "scrollbarThumb": "#4e3424",
  "scrollbarThumbHover": "#d4895a",
  "terminal": {
    "background": "#0a0705",
    "foreground": "#e8d4c0",
    "cursor": "#5ec4a8",
    "selection": "#4e3820",
    "black": "#1e1610",
    "red": "#d45448",
    "green": "#6aaa70",
    "yellow": "#e0a048",
    "blue": "#6888a0",
    "magenta": "#a87870",
    "cyan": "#5ec4a8",
    "white": "#e8d4c0",
    "brightBlack": "#6a5440",
    "brightRed": "#e8786c",
    "brightGreen": "#8ac890",
    "brightYellow": "#f4c070",
    "brightBlue": "#88a8c0",
    "brightMagenta": "#c89890",
    "brightCyan": "#80dcc4",
    "brightWhite": "#fff0e0"
  }
}
