{
  "id": "iris-protocol",
  "name": "Iris Protocol",
  "appBackground": "#080b16",
  "surface": "#10162a",
  "surfaceAlt": "#1a223c",
  "border": "#3a4a78",
  "text": "#e8ecff",
  "textMuted": "#8a98c4",
  "accent": "#7a8cff",
  "accentContrast": "#0a0e1c",
  "focus": "#b0baff",
  "danger": "#ff6a88",
  "warning": "#e8c060",
  "success": "#5cd0a8",
  "scrollbarTrack": "#0c1020",
  "scrollbarThumb": "#2e3a64",
  "scrollbarThumbHover": "#7a8cff",
  "terminal": {
    "background": "#060810",
    "foreground": "#dce2f8",
    "cursor": "#b0baff",
    "selection": "#2a3870",
    "black": "#141828",
    "red": "#ff6a88",
    "green": "#5cd0a8",
    "yellow": "#e8c060",
    "blue": "#7a8cff",
    "magenta": "#a878e0",
    "cyan": "#68b8e0",
    "white": "#dce2f8",
    "brightBlack": "#505888",
    "brightRed": "#ff90a8",
    "brightGreen": "#80e4c4",
    "brightYellow": "#ffe088",
    "brightBlue": "#b0baff",
    "brightMagenta": "#c8a0f4",
    "brightCyan": "#90d4f0",
    "brightWhite": "#f6f8ff"
  }
}
