{
  "id": "helios-flare",
  "name": "Helios Flare",
  "appBackground": "#1a0c06",
  "surface": "#26140a",
  "surfaceAlt": "#361c10",
  "border": "#784830",
  "text": "#fff6e0",
  "textMuted": "#c8a078",
  "accent": "#fff1a8",
  "accentContrast": "#1c1004",
  "focus": "#ffffff",
  "danger": "#ff5a48",
  "warning": "#ffb040",
  "success": "#88c870",
  "scrollbarTrack": "#1e1008",
  "scrollbarThumb": "#5a3420",
  "scrollbarThumbHover": "#fff1a8",
  "terminal": {
    "background": "#140804",
    "foreground": "#f8e8c8",
    "cursor": "#ffffff",
    "selection": "#6a3c18",
    "black": "#24180c",
    "red": "#ff5a48",
    "green": "#88c870",
    "yellow": "#ffb040",
    "blue": "#7088a8",
    "magenta": "#c07070",
    "cyan": "#80b0a0",
    "white": "#f8e8c8",
    "brightBlack": "#785840",
    "brightRed": "#ff8474",
    "brightGreen": "#a8e090",
    "brightYellow": "#fff1a8",
    "brightBlue": "#90a8c8",
    "brightMagenta": "#e09090",
    "brightCyan": "#a0d0c0",
    "brightWhite": "#fffaf0"
  }
}
